{
  "port": 3000,
  "metricPort": 3001,
  "logLevel": "info",
  "dbPath": "./data",
  "raft": {
    "enabled": true,
    "nodeId": "node-1",
    "host": "localhost",
    "port": 4000,
    "peers": [
      {
        "id": "node-2",
        "host": "localhost",
        "port": 4001
      },
      {
        "id": "node-3",
        "host": "localhost",
        "port": 4002
      }
    ],
    "electionTimeout": 5000,
    "heartbeatInterval": 1000
  },
  "chains": [
    {
      "bech32Prefix": "init",
      "chainId": "init_9000-1",
      "gasPrice": "0.15uinit",
      "restUri": "https://rest.initia-9000.initia.tech",
      "rpcUri": "https://rpc.initia-9000.initia.tech",
      "wallets": [
        {
          "key": {
            "type": "mnemonic",
            "privateKey": "your mnemonic phrase here"
          },
          "maxHandlePacket": 100
        }
      ]
    }
  ]
} 