{
  "$schema": "./config.schema.json",
  "port": 7010,
  "metricPort": 70001,
  "logLevel": "info",
  "raft": {
    "enabled": true,
    "nodeId": "node-1",
    "host": "127.0.0.1",
    "port": 9184,
    "peers": [],
    "psk": "70696E6B646F69646F69"
  },
  "rpcRequestTimeout": 5000,
  "maxParallelBlocks": 20,
  "chains": [
    {
      "bech32Prefix": "init",
      "chainId": "chain-1",
      "gasPrice": "0.15gas",
      "restUri": "https://rest.chain-1.com",
      "rpcUri": ["https://rpc.chain-1.com", "https://rpc.chain-1.com/fallback"],
      "wallets": [
        {
          "key": {
            "type": "raw",
            "privateKey": "123..."
          },
          "maxHandlePacket": 10,
          "startHeight": 0
        },
        {
          "key": {
            "type": "mnemonic",
            "privateKey": "repair family apology column ..."
          },
          "maxHandlePacket": 10,
          "packetFilter": {
            "connections": [{ "connectionId": "conneciton-1" }]
          }
        }
      ],
      "feeFilter": {
        "recvFee": [{ "denom": "gas", "amount": 100 }],
        "timeoutFee": [{ "denom": "gas", "amount": 200 }],
        "ackFee": [{ "denom": "gas", "amount": 300 }]
      }
    },
    {
      "bech32Prefix": "init",
      "chainId": "chain-2",
      "gasPrice": "0umin",
      "restUri": [
        "https://rest.chain-2.com",
        "https://rest.chain-2.com/fallback"
      ],
      "rpcUri": "https://rpc.chain-2.com",
      "wallets": [
        {
          "key": {
            "type": "raw",
            "privateKey": "123..."
          },
          "maxHandlePacket": 10
        }
      ]
    }
  ]
}
